{
  "schema_version": "1.0.0",
  "artifact": "data_profile",
  "generated_at": "2026-08-13T16:40:18Z",
  "data_status": "real",
  "notes": "Descriptive statistics on the committed Form 4 table (2011\u20132025). superseded_rows_removed is the SPEC \u00a75.2 count; the parquet is post-dedup.",
  "coverage": {
    "start": "2011-01-03",
    "end": "2025-12-31"
  },
  "totals": {
    "transactions": 4491080,
    "filings": 2291596,
    "distinct_issuers": 12798,
    "distinct_insiders": 149693,
    "open_market_purchases": 489372,
    "superseded_rows_removed": 59480,
    "dropped_missing_price": 10332
  },
  "transaction_codes": [
    {
      "code": "S",
      "label": "Open-market or private sale",
      "count": 1310483,
      "share": 0.2917968506461697,
      "included_in_signal": false
    },
    {
      "code": "A",
      "label": "Grant, award, or other acquisition",
      "count": 905647,
      "share": 0.2016546131442771,
      "included_in_signal": false
    },
    {
      "code": "M",
      "label": "Exercise or conversion of derivative",
      "count": 684398,
      "share": 0.15239051631233466,
      "included_in_signal": false
    },
    {
      "code": "F",
      "label": "Shares withheld for tax obligation",
      "count": 656393,
      "share": 0.14615482244805258,
      "included_in_signal": false
    },
    {
      "code": "P",
      "label": "Open-market or private purchase",
      "count": 489372,
      "share": 0.10896532682561878,
      "included_in_signal": true
    },
    {
      "code": "J",
      "label": "Other acquisition or disposition",
      "count": 143236,
      "share": 0.03189344211191963,
      "included_in_signal": false
    },
    {
      "code": "G",
      "label": "Bona fide gift",
      "count": 103035,
      "share": 0.022942143092530082,
      "included_in_signal": false
    },
    {
      "code": "D",
      "label": "Disposition to the issuer",
      "count": 102358,
      "share": 0.022791399841463524,
      "included_in_signal": false
    },
    {
      "code": "C",
      "label": "Conversion of derivative security",
      "count": 64546,
      "share": 0.014372044140830268,
      "included_in_signal": false
    },
    {
      "code": "X",
      "label": "Exercise of in-the-money derivative",
      "count": 10182,
      "share": 0.0022671606829537663,
      "included_in_signal": false
    },
    {
      "code": "U",
      "label": "Tender of shares",
      "count": 7289,
      "share": 0.001622994914363583,
      "included_in_signal": false
    },
    {
      "code": "L",
      "label": "Small acquisition",
      "count": 6138,
      "share": 0.0013667091211913393,
      "included_in_signal": false
    },
    {
      "code": "I",
      "label": "Discretionary transaction",
      "count": 5629,
      "share": 0.001253373353402745,
      "included_in_signal": false
    },
    {
      "code": "W",
      "label": "Acquisition or disposition by will",
      "count": 1407,
      "share": 0.00031328767245295116,
      "included_in_signal": false
    },
    {
      "code": "Z",
      "label": "Voting trust deposit or withdrawal",
      "count": 680,
      "share": 0.0001514112418393794,
      "included_in_signal": false
    },
    {
      "code": "O",
      "label": "Code O",
      "count": 210,
      "share": 4.67593540974554e-05,
      "included_in_signal": false
    },
    {
      "code": "H",
      "label": "Expiration of long position",
      "count": 47,
      "share": 1.04651887741924e-05,
      "included_in_signal": false
    },
    {
      "code": "E",
      "label": "Expiration of short position",
      "count": 27,
      "share": 6.011916955387123e-06,
      "included_in_signal": false
    }
  ],
  "event_density": [
    {
      "month": "2011-01",
      "qualifying_purchases": 2060,
      "distinct_issuers": 428,
      "distinct_insiders": 850,
      "median_trade_value_usd": 4945.01
    },
    {
      "month": "2011-02",
      "qualifying_purchases": 2584,
      "distinct_issuers": 596,
      "distinct_insiders": 1112,
      "median_trade_value_usd": 9152.0
    },
    {
      "month": "2011-03",
      "qualifying_purchases": 3884,
      "distinct_issuers": 891,
      "distinct_insiders": 1345,
      "median_trade_value_usd": 9499.5
    },
    {
      "month": "2011-04",
      "qualifying_purchases": 2003,
      "distinct_issuers": 466,
      "distinct_insiders": 906,
      "median_trade_value_usd": 8681.75
    },
    {
      "month": "2011-05",
      "qualifying_purchases": 4380,
      "distinct_issuers": 906,
      "distinct_insiders": 1508,
      "median_trade_value_usd": 9752.9
    },
    {
      "month": "2011-06",
      "qualifying_purchases": 2894,
      "distinct_issuers": 761,
      "distinct_insiders": 1271,
      "median_trade_value_usd": 10000.2
    },
    {
      "month": "2011-07",
      "qualifying_purchases": 1545,
      "distinct_issuers": 391,
      "distinct_insiders": 755,
      "median_trade_value_usd": 6570.188999999999
    },
    {
      "month": "2011-08",
      "qualifying_purchases": 8309,
      "distinct_issuers": 1441,
      "distinct_insiders": 2932,
      "median_trade_value_usd": 14184.0
    },
    {
      "month": "2011-09",
      "qualifying_purchases": 3780,
      "distinct_issuers": 828,
      "distinct_insiders": 1523,
      "median_trade_value_usd": 9842.300000000001
    },
    {
      "month": "2011-10",
      "qualifying_purchases": 2148,
      "distinct_issuers": 495,
      "distinct_insiders": 891,
      "median_trade_value_usd": 7103.0
    },
    {
      "month": "2011-11",
      "qualifying_purchases": 4065,
      "distinct_issuers": 936,
      "distinct_insiders": 1623,
      "median_trade_value_usd": 10579.5
    },
    {
      "month": "2011-12",
      "qualifying_purchases": 5736,
      "distinct_issuers": 780,
      "distinct_insiders": 1396,
      "median_trade_value_usd": 2129.0
    },
    {
      "month": "2012-01",
      "qualifying_purchases": 1996,
      "distinct_issuers": 471,
      "distinct_insiders": 841,
      "median_trade_value_usd": 6110.0
    },
    {
      "month": "2012-02",
      "qualifying_purchases": 2386,
      "distinct_issuers": 623,
      "distinct_insiders": 1141,
      "median_trade_value_usd": 10281.375
    },
    {
      "month": "2012-03",
      "qualifying_purchases": 2694,
      "distinct_issuers": 698,
      "distinct_insiders": 1179,
      "median_trade_value_usd": 9600.0
    },
    {
      "month": "2012-04",
      "qualifying_purchases": 1973,
      "distinct_issuers": 438,
      "distinct_insiders": 848,
      "median_trade_value_usd": 7333.125
    },
    {
      "month": "2012-05",
      "qualifying_purchases": 4922,
      "distinct_issuers": 996,
      "distinct_insiders": 1961,
      "median_trade_value_usd": 10241.16
    },
    {
      "month": "2012-06",
      "qualifying_purchases": 3190,
      "distinct_issuers": 738,
      "distinct_insiders": 1246,
      "median_trade_value_usd": 9901.900000000001
    },
    {
      "month": "2012-07",
      "qualifying_purchases": 1823,
      "distinct_issuers": 412,
      "distinct_insiders": 863,
      "median_trade_value_usd": 11000.0
    },
    {
      "month": "2012-08",
      "qualifying_purchases": 4958,
      "distinct_issuers": 802,
      "distinct_insiders": 1419,
      "median_trade_value_usd": 3845.0
    },
    {
      "month": "2012-09",
      "qualifying_purchases": 2145,
      "distinct_issuers": 553,
      "distinct_insiders": 889,
      "median_trade_value_usd": 7994.79
    },
    {
      "month": "2012-10",
      "qualifying_purchases": 1899,
      "distinct_issuers": 419,
      "distinct_insiders": 777,
      "median_trade_value_usd": 8350.0
    },
    {
      "month": "2012-11",
      "qualifying_purchases": 6168,
      "distinct_issuers": 889,
      "distinct_insiders": 1640,
      "median_trade_value_usd": 2775.0
    },
    {
      "month": "2012-12",
      "qualifying_purchases": 3040,
      "distinct_issuers": 731,
      "distinct_insiders": 1265,
      "median_trade_value_usd": 8006.25
    },
    {
      "month": "2013-01",
      "qualifying_purchases": 1746,
      "distinct_issuers": 443,
      "distinct_insiders": 822,
      "median_trade_value_usd": 7500.0
    },
    {
      "month": "2013-02",
      "qualifying_purchases": 2215,
      "distinct_issuers": 543,
      "distinct_insiders": 936,
      "median_trade_value_usd": 13403.0
    },
    {
      "month": "2013-03",
      "qualifying_purchases": 2462,
      "distinct_issuers": 639,
      "distinct_insiders": 1164,
      "median_trade_value_usd": 10800.0
    },
    {
      "month": "2013-04",
      "qualifying_purchases": 2049,
      "distinct_issuers": 449,
      "distinct_insiders": 844,
      "median_trade_value_usd": 6970.76
    },
    {
      "month": "2013-05",
      "qualifying_purchases": 3398,
      "distinct_issuers": 763,
      "distinct_insiders": 1376,
      "median_trade_value_usd": 9997.380000000001
    },
    {
      "month": "2013-06",
      "qualifying_purchases": 2491,
      "distinct_issuers": 631,
      "distinct_insiders": 1003,
      "median_trade_value_usd": 8561.0
    },
    {
      "month": "2013-07",
      "qualifying_purchases": 1889,
      "distinct_issuers": 419,
      "distinct_insiders": 879,
      "median_trade_value_usd": 9733.5
    },
    {
      "month": "2013-08",
      "qualifying_purchases": 3289,
      "distinct_issuers": 789,
      "distinct_insiders": 1491,
      "median_trade_value_usd": 11215.0
    },
    {
      "month": "2013-09",
      "qualifying_purchases": 1747,
      "distinct_issuers": 551,
      "distinct_insiders": 891,
      "median_trade_value_usd": 8995.0
    },
    {
      "month": "2013-10",
      "qualifying_purchases": 1478,
      "distinct_issuers": 408,
      "distinct_insiders": 840,
      "median_trade_value_usd": 16413.2
    },
    {
      "month": "2013-11",
      "qualifying_purchases": 2617,
      "distinct_issuers": 691,
      "distinct_insiders": 1146,